{
  "key": "REACH_EFFORT",
  "version": 1,
  "name": "Portée sur effort (méthode fictive)",
  "criteria": [
    {
      "key": "reach",
      "code": "Portée",
      "label": "Reach",
      "definition": "Nombre de personnes touchées.",
      "header": "Reach"
    },
    {
      "key": "effort",
      "code": "Effort",
      "label": "Effort",
      "definition": "Travail nécessaire pour livrer.",
      "header": "Effort"
    }
  ],
  "computedValues": [
    {
      "key": "ratio",
      "code": "Ratio",
      "label": "Reach / Effort",
      "definition": "Portée divisée par effort.",
      "header": "Ratio",
      "display": "DECIMAL_2"
    }
  ],
  "formula": "Ratio = Portée / Effort",
  "tieBreakRule": "Ratio décroissant, puis identifiant croissant sans tenir compte de la casse. Les fonctionnalités incomplètes viennent ensuite."
}
